Enter password: **********
Welcome to the MySQL monitor.  Commands end with ; or \g.
Your MySQL connection id is 8
Server version: 8.0.30 MySQL Community Server - GPL

Copyright (c) 2000, 2022, Oracle and/or its affiliates.

Oracle is a registered trademark of Oracle Corporation and/or its
affiliates. Other names may be trademarks of their respective
owners.

Type 'help;' or '\h' for help. Type '\c' to clear the current input statement.

mysql> use inventory;
Database changed
mysql> show tables;
+---------------------+
| Tables_in_inventory |
+---------------------+
| product             |
| sale                |
| supplier            |
+---------------------+
3 rows in set (0.04 sec)

mysql> select * from product;
+-----+-------+-------+
| PID | PNAME | PRICE |
+-----+-------+-------+
| 101 | Shirt |   300 |
| 102 | Shoes |   900 |
| 103 | Watch |  1000 |
+-----+-------+-------+
3 rows in set (0.03 sec)

mysql> insert into product(PID, PNAME) values(104,'gloves');
Query OK, 1 row affected (0.01 sec)

mysql> select * from product;
+-----+--------+-------+
| PID | PNAME  | PRICE |
+-----+--------+-------+
| 101 | Shirt  |   300 |
| 102 | Shoes  |   900 |
| 103 | Watch  |  1000 |
| 104 | gloves |  NULL |
+-----+--------+-------+
4 rows in set (0.00 sec)

mysql> update product set PRICE = 1500 where PID = 103;
Query OK, 1 row affected (0.02 sec)
Rows matched: 1  Changed: 1  Warnings: 0

mysql> select * from product;
+-----+--------+-------+
| PID | PNAME  | PRICE |
+-----+--------+-------+
| 101 | Shirt  |   300 |
| 102 | Shoes  |   900 |
| 103 | Watch  |  1500 |
| 104 | gloves |  NULL |
+-----+--------+-------+
4 rows in set (0.00 sec)

mysql> update product set PRICE = 300 where PRICE is NULL;
Query OK, 1 row affected (0.00 sec)
Rows matched: 1  Changed: 1  Warnings: 0

mysql> select * from product;
+-----+--------+-------+
| PID | PNAME  | PRICE |
+-----+--------+-------+
| 101 | Shirt  |   300 |
| 102 | Shoes  |   900 |
| 103 | Watch  |  1500 |
| 104 | gloves |   300 |
+-----+--------+-------+
4 rows in set (0.00 sec)

mysql> delete from product where PID = 104;
Query OK, 1 row affected (0.03 sec)

mysql> select * from sale;
Empty set (0.00 sec)

mysql> insert into sale values(200,101,60);
Query OK, 1 row affected (0.00 sec)

mysql> insert into sale values(201,102,50);
Query OK, 1 row affected (0.00 sec)

mysql> insert into sale values(202,103,50);
Query OK, 1 row affected (0.00 sec)

mysql> select * from sale;
+------+-----+------+
| SID  | PID | QNTY |
+------+-----+------+
|  200 | 101 |   60 |
|  201 | 102 |   50 |
|  202 | 103 |   50 |
+------+-----+------+
3 rows in set (0.00 sec)

mysql> delete from product where PID = 101;
ERROR 1451 (23000): Cannot delete or update a parent row: a foreign key constraint fails (`inventory`.`sale`, CONSTRAINT `sale_ibfk_1` FOREIGN KEY (`PID`) REFERENCES `product` (`PID`))
mysql> insert into sale values(203,105,40);
ERROR 1452 (23000): Cannot add or update a child row: a foreign key constraint fails (`inventory`.`sale`, CONSTRAINT `sale_ibfk_1` FOREIGN KEY (`PID`) REFERENCES `product` (`PID`))
mysql>
