Enter password: **********
Welcome to the MySQL monitor.  Commands end with ; or \g.
Your MySQL connection id is 9
Server version: 8.0.30 MySQL Community Server - GPL

Copyright (c) 2000, 2022, Oracle and/or its affiliates.

Oracle is a registered trademark of Oracle Corporation and/or its
affiliates. Other names may be trademarks of their respective
owners.

Type 'help;' or '\h' for help. Type '\c' to clear the current input statement.

mysql> use inventory;
Database changed
mysql> show tables;
+---------------------+
| Tables_in_inventory |
+---------------------+
| product             |
| sale                |
| supplier            |
+---------------------+
3 rows in set (0.01 sec)

mysql> create view V as select * from product;
Query OK, 0 rows affected (0.02 sec)

mysql> select * from V
    -> ;
+-----+-------+-------+
| PID | PNAME | PRICE |
+-----+-------+-------+
| 101 | Shirt |   300 |
| 102 | Shoes |   900 |
| 103 | Watch |  1500 |
+-----+-------+-------+
3 rows in set (0.00 sec)

mysql> select PNAME,PRICE from V;
+-------+-------+
| PNAME | PRICE |
+-------+-------+
| Shirt |   300 |
| Shoes |   900 |
| Watch |  1500 |
+-------+-------+
3 rows in set (0.00 sec)

mysql> insert into V values(104,'Gloves', 300);
Query OK, 1 row affected (0.01 sec)

mysql> select * from V;
+-----+--------+-------+
| PID | PNAME  | PRICE |
+-----+--------+-------+
| 101 | Shirt  |   300 |
| 102 | Shoes  |   900 |
| 103 | Watch  |  1500 |
| 104 | Gloves |   300 |
+-----+--------+-------+
4 rows in set (0.00 sec)

mysql> upadte V set PRICE = 200 where PID = 104;
ERROR 1064 (42000): You have an error in your SQL syntax; check the manual that corresponds to your MySQL server version for the right syntax to use near 'upadte V set PRICE = 200 where PID = 104' at line 1
mysql> update V set PRICE = 200 where PID = 104;
Query OK, 1 row affected (0.01 sec)
Rows matched: 1  Changed: 1  Warnings: 0

mysql> select * from V;
+-----+--------+-------+
| PID | PNAME  | PRICE |
+-----+--------+-------+
| 101 | Shirt  |   300 |
| 102 | Shoes  |   900 |
| 103 | Watch  |  1500 |
| 104 | Gloves |   200 |
+-----+--------+-------+
4 rows in set (0.00 sec)

mysql> insert V(PID,PNAME) values(105,'phone');
Query OK, 1 row affected (0.00 sec)

mysql> select * from V;
+-----+--------+-------+
| PID | PNAME  | PRICE |
+-----+--------+-------+
| 101 | Shirt  |   300 |
| 102 | Shoes  |   900 |
| 103 | Watch  |  1500 |
| 104 | Gloves |   200 |
| 105 | phone  |  NULL |
+-----+--------+-------+
5 rows in set (0.00 sec)

mysql> delete from V where PRICE is NULL;
Query OK, 1 row affected (0.01 sec)

mysql> select * from V;
+-----+--------+-------+
| PID | PNAME  | PRICE |
+-----+--------+-------+
| 101 | Shirt  |   300 |
| 102 | Shoes  |   900 |
| 103 | Watch  |  1500 |
| 104 | Gloves |   200 |
+-----+--------+-------+
4 rows in set (0.00 sec)

mysql> create view V1 as select product.PNAME, sale.QTY, product.PRICE, (sale.QTY * product.PRICE) as total_amt from sale join product on sale.PID = product.PID;
ERROR 1054 (42S22): Unknown column 'sale.QTY' in 'field list'
mysql> desc sale;
+-------+------+------+-----+---------+-------+
| Field | Type | Null | Key | Default | Extra |
+-------+------+------+-----+---------+-------+
| SID   | int  | YES  |     | NULL    |       |
| PID   | int  | NO   | PRI | NULL    |       |
| QNTY  | int  | YES  |     | NULL    |       |
+-------+------+------+-----+---------+-------+
3 rows in set (0.02 sec)

mysql> create view V1 as select product.PNAME, sale.QNTY, product.PRICE, (sale.QNTY * product.PRICE) as total_amt from sale join product on sale.PID = product.PID;
Query OK, 0 rows affected (0.01 sec)

mysql> select * from V1;
+-------+------+-------+-----------+
| PNAME | QNTY | PRICE | total_amt |
+-------+------+-------+-----------+
| Shirt |   60 |   300 |     18000 |
| Shoes |   50 |   900 |     45000 |
| Watch |   50 |  1500 |     75000 |
+-------+------+-------+-----------+
3 rows in set (0.00 sec)

mysql> create index I on product(PID);
Query OK, 0 rows affected (0.09 sec)
Records: 0  Duplicates: 0  Warnings: 0

mysql> show indexes from product;
+---------+------------+----------+--------------+-------------+-----------+-------------+----------+--------+------+------------+---------+---------------+---------+------------+
| Table   | Non_unique | Key_name | Seq_in_index | Column_name | Collation | Cardinality | Sub_part | Packed | Null | Index_type | Comment | Index_comment | Visible | Expression |
+---------+------------+----------+--------------+-------------+-----------+-------------+----------+--------+------+------------+---------+---------------+---------+------------+
| product |          0 | PRIMARY  |            1 | PID         | A         |           4 |     NULL |   NULL |      | BTREE      |         |               | YES     | NULL       |
| product |          1 | I        |            1 | PID         | A         |           4 |     NULL |   NULL |      | BTREE      |         |               | YES     | NULL       |
+---------+------------+----------+--------------+-------------+-----------+-------------+----------+--------+------+------------+---------+---------------+---------+------------+
2 rows in set (0.01 sec)

mysql>
